{
  "$schema": "http://json-schema.org/draft-07/schema#",
  "$id": "urn:stjarndag:world-engine:v1:progression",
  "title": "ProgressionMap",
  "type": "object",
  "required": [
    "world_slug",
    "progression_model",
    "nodes"
  ],
  "properties": {
    "world_slug": {
      "type": "string"
    },
    "progression_model": {
      "type": "string"
    },
    "phases": {
      "type": "array",
      "items": {
        "type": "string"
      }
    },
    "nodes": {
      "type": "array",
      "items": {
        "type": "object",
        "required": [
          "node_id",
          "order",
          "node_type",
          "emotional_beat",
          "unlock_signal"
        ],
        "properties": {
          "node_id": {
            "type": "string",
            "pattern": "^[a-z0-9_]+$"
          },
          "order": {
            "type": "integer",
            "minimum": 0
          },
          "node_type": {
            "type": "string",
            "enum": [
              "build",
              "room",
              "npc",
              "animal",
              "animation",
              "feature",
              "sound",
              "bridge",
              "boat",
              "tree",
              "book",
              "decoration"
            ]
          },
          "name_sv": {
            "type": "string"
          },
          "name_en": {
            "type": "string"
          },
          "emotional_beat": {
            "type": "string"
          },
          "unlock_signal": {
            "type": "string"
          },
          "pack_config_key": {
            "type": "string"
          },
          "scene_id": {
            "type": "string"
          },
          "entity_ref": {
            "type": "string"
          },
          "metadata": {
            "type": "object"
          }
        },
        "additionalProperties": false
      },
      "minItems": 1
    }
  },
  "additionalProperties": false
}
